거리명,거리소개,소재지도로명,소재지지번주소,관리기관전화번호
사후면세점 특화거리,"목포상권에 중국관광객을 유치하기 위해 목포역 인근 차 없는 거리를 중심으로 집단 사후면세점 지정, 쇼핑지도 제작, 중국어 안내판 정비, 상설이벤트 진행 등 쇼핑 특화거리를 조성",전라남도 목포시 영산로 93,전라남도 목포시명륜동 6-16,061-270-8636
신해철거리,마왕 신해철을 기념하기 위한 작업실과 조형물이 있는 거리,경기도 성남시 분당구 발이봉로3번길 2 일원,경기도 성남시 분당구 수내동 89-1 일원,031-729-8603
쌍화차거리,"난방시설이 잘되어 있지 않던 시절, 추운 겨울날 정읍경찰서 구치소에 수감된 사람들에게 몸을 녹이라고 가족들이 쌍화차를 사식으로 넣어주기 시작하면서부터 유래되었다고 전해짐",전라북도 정읍시 중앙1길,전라북도 정읍시 수성동 637-3,063-539-5602
남산자동차부속골목,"1968년경부터 명덕네거리 주변에 자동차 중고 부속상이 생겨나서 부속품판매 및 자동차수리를 하였으며 1978년 도로가 확장 개통되면서 남문시장에서 명덕네거리 일원의 골목을 중심으로 자동차 관련 점포들이 모여들어 오늘날의 상가가 형성되었습니다. 현재는 80여개의 업소가 오디오, 타이어, 에어컨, 시트커버, 썬팅, 기타 자동차부속품 판매와 자동차 수리를 하고 있어 자동차에 대한 원스톱서비스가 가능한 곳이라 할 수 있습니다. 2010년부터 매년 스트리트 모터 페스티벌이 개최되고 있으며 축제기간 중에는 세계의 명차들을 한 자리에서 만날 수 있습니다.",대구광역시 중구 명덕로35길 70,대구광역시 중구 남산동 596-7,053-661-2643
대신미싱골목,1970년대 서문시장과 달성공원 사이 황폐한 골목으로 지가가 싸서 임대료 부담이 적어 일부 사업자가 이주하여 영업해 왔으며 1980년대부터 한집 두집 모이기 시작하여 1980~90년대에는 섬유경기활황과 어울려 전성기를 이루었습니다. 현재는 40여 업소가 영업 중에 있습니다.,대구광역시 중구 국채보상로93길 35,대구광역시 중구 대신동 64-25,053-661-2643
대신양말골목,1980년대 원일상회 박정원씨가 최초로 양말소매상을 경영하였고 그 후부터 상인들이 모이기 시작하여 현재의 양말골목으로 형성되어 왔습니다. 계성초등학교 입구의 좁은 골목 양쪽으로 영업하고 있는 이 업소들은 다양한 양말을 저렴한 가격으로 판매하고 있습니다.,대구광역시 중구 달구벌대로 1991-11,대구광역시 중구 대신동 993,053-661-2643
행복로 문화의거리,"의정부시의 구도심지역의 교통체계를 개선하고, 시민의 여가공간 확보와 젊음이 넘치는 거리 조성",경기도 의정부시 행복로,경기도 의정부시 의정부동 180-11,031-828-2963
신장쇼핑몰거리,송탄 관광특구내 미군 기지를 중심으로 쇼핑과 유흥 시설이 들어선 거리,경기도 평택시 쇼핑로 35 (신장동),경기도 평택시 신장동 324-11,031-8024-3291
동인찜갈비골목,"1960년대 중반 현 동인동 골목일대에 술안주와 식사용으로 소갈비에 마늘과 고춧가루를 넣어 연탄불에 양재기로 찜을 해 요리하는 것이 점차 호응을 얻어 한집 두집 개업하고 확장하여 현재의 찜갈비 골목으로 자리매김 하였습니다. 동인동 찜갈비는 대구 특유의 매운맛이 살아있는 전통 음식이기도 합니다. 2003 대구하계유니버시아드 대회 이후 더욱 널리 알려지면서, 현재 전국 각지에서 동인동 찜갈비를 맛보기 위해 대구를 찾는 발걸음이 늘고 있습니다. 갈비하면 일반적으로 간장 양념을 떠올리게 되는데, 동인동찜갈비의 특징은 고춧가루와 마늘을 이용하여 매콤 달콤한 붉은 양념으로 소비자의 입맛을 신선하게 자극하는 것입니다. 질기지 않고 부드럽게 씹히는 고기맛과 마지막 남은 양념에 비벼먹는 밥맛이 일품입니다. 동인동찜갈비만의 매력은 찜갈비를 담는 용기에서도 찾아볼 수 있습니다. 현대인들에게 익숙한 세련된 용기 대신 6,70년대에 쓰던 노란색 찌그러진 양은 그릇이 밥상 위에 올라오는데, 이는 먹는 재미와 동시에 구수한 고향냄새까지 느낄 수 있으며 빠른시간에 조리가 되어 신선도가 좋은 찜갈비로 내·외국인 모두에게 각광받고 있는 음식으로 자리매김 하였습니다. 마늘과 생강 범벅인 양념을 처음 본 외지인들은 지레 겁을 먹지만, 한번 맛본 사람들은 그 특유의 맛에 빠져들어 다시 찾게 되는 음식입니다. 느끼하지 않고 칼칼하고 개운한 맛으로 현재 대구 맛의 명소로 자리 잡았으며 매출액의 일부를 정기적으로 기부하여 「착한골목 1호」로 지정되었습니다.",대구광역시 중구 동덕로36길 9-17,대구광역시 중구 동인동1가 297-2,053-661-2643
봉산문화거리,"봉산문화거리는 서울 인사동거리에 비견되는 대구의 대표적인 문화예술거리입니다. 1980년대 중반부터 형성되기 시작한 이 거리는 현재 50여개의 화랑, 화방, 골동품점, 표구사 등이 들어서 있습니다. 초기에는 미술관련재료 판매, 표구 제작, 동양화 판매 위주였으나, 현재는 여러 화랑에서 다양한 미술작품을 전시,판매도 하고 있어서, 대구를 대표하는 화가들의 작품들을 이곳에서 구경할 수 있습니다. 대구시민의 문화적 욕구를 충족시키기 위해 매년 4월에는 봉산공예디자인전이 개최되고, 10월에는 봉산미술제가 개최되고 있습니다. 또한 2004년에는 봉산문화회관 바로가기 이 건립되어 각종 전시회 및 공연을 개최하여 봉산문화거리 활성화에 노력하고 있습니다.",대구광역시 중구 봉산문화길 49,대구광역시 중구 봉산동 225-5,053-661-2643
북성공구골목,"국산공구가 생산되지 않던 1947년경 지금의 인교동 달성공원 입구 골목(당시 푸른다리)에서 미군부대로부터 불하된 폐공구를 수집하던 11명이 영업을 시작하게 된 것이 시초가 되었고, 기계공업의 발달로 관련업소가 계속 늘어나 집단상가를 이루면서 오늘날의 공구골목이 형성되었습니다. 현재 400여개의 업체가 각종 산업용 공구를 판매하고 있으며 공구골목의 역사와 애환을 담은 북성로공구박물관이 개관되었습니다.",대구광역시 중구 북성로 65-2,대구광역시 중구 북성로2가 61,053-661-2643
약전골목,"남성로 중앙치안센터 맞은편에는 170여개의 한약방과 한의원이 즐비하게 늘어서 있습니다. 도로를 따라 600여미터나 이어지는 이 약전골목은 조선시대(효종9년,1658년)에 개설된 약령시에 기원을 두고 있습니다. 대구는 약재의 본산지인 경상도를 배후에 두고 낙동강을 통한 운송도 수월하여 약령시가 자연스럽게 형성되었습니다. 조선시대 대구 약령시는 약재 수확기인 봄, 가을에 맞추어 한해에 두 번씩 열렸는데 성시를 이룰 때는 대구인구보다 약령시 출시자가 많을 정도였다고 합니다. 그러나 서양의 양약이 보급되고 일제의 탄압정책이 가중되면서 약령시는 점차 쇠퇴의 길로 들어서고 현재 자리에 약전골목이 조성되어 맥을 잇고 있습니다. 근래 들어 한약에 대한 일반인의 관심이 높아지면서 약전골목은 옛 명성을 회복하고 있고, 매년 5월의 약령시축제와 2003년 한방특구 지정, 약령시한의약박물관 건립으로 새롭게 활기를 띄고 있습니다. 약령시회관 2층의 약령시전시관에서는 인삼,산삼,녹용,해마 등 각종 한약재를 비롯하여 [동의보감], [동의수세보원] 등의 한의서와 약연, 약작두 등의 한방기구 등 한방관련용품 300여 점이 전시되어 있습니다.",대구광역시 중구 남성로 25,대구광역시 중구 남성로 51-6,053-661-2643
인교동오토바이골목,"이 곳은 본래 하천이 흐르던 지역이었으나 1953년 하천이 복개되고 1961년 인교동 154번지 서울오토바이상회를 시작으로 오토바이 관련상가가 밀집되면서 오늘날의 오토바이골목이 형성 되었습니다. 서울, 대전의 오토바이상가와 함께 전국의 대표적인 오토바이골목으로 현재 60여개 관련 업소가 영업 중에 있으며, 저렴한 가격으로 다양한 오토바이를 판매하고 있어서 많은 사람들이 찾고 있습니다.",대구광역시 중구 서성로13길 64,대구광역시 중구 시장북로 20-2,053-661-2643
화평동 냉면거리,세숫대야 냉면으로 유명한 특색음식거리,인천광역시 동구 화평로 10,인천광역시 동구 화평동 531-100,032-770-6523
류현진 거리,류현진 선수와 야구를 상징할 수 있는 대표거리(동산로 및 새천년로),인천광역시 동구 동산로 58,인천광역시 동구 송림동 97-12,032-770-6103
삼가면 도시재생 특화거리,"삼가 한우 식당이 밀집한 거리를 한우테마로 특화거리를 조성한 것으로 한우거리 상점 및 식당과의 경관 협정을 통한 가로환경의 통일성 추구 및 경관 개선하였으며, 거리 경관 개선, 간판 정비, 가로시설물 정리, 보행환경 개선, 소공원 조성 등 백의종군 이순신장군을 주제로 한 테마거리를 조성하였음",경상남도 합천군 삼가면 삼가1로,경상남도 합천군 삼가면 일부리 949,055-930-3416
익산문화예술의거리,익산시 구도심 일원 KTX역세권과 연계한 주거문화상업 아트지구,전라북도 익산시 중앙로(중앙동2가),전라북도 익산시 중앙동2가 45,063-859-5826
박종철거리,민주열사 박종철을 기념하는 거리,서울특별시 관악구 대학5길,서울특별시 관악구 신림동 246-1,02-879-5603
광릉숲음식문화특화테마거리,"능안마을은 오랜 역사를 가진 집성촌이 아닌 6.25 전쟁이후 형성된 마을로 향토음식을 기반으로 16개의 업소가 영업중에 있으며, 인근에는 969년(광종 20)창건된 봉선사와 국립수목원과 광릉 및 크낙새서식지 등 관광자원이 풍부한 지역임",경기도 남양주시 진접읍 광릉수목원로 179-19,경기도 남양주시 진접읍 부평리 258-49,031-590-2237
진평음식문화특화거리,젊은층의 독특한 문화와 음식이 있는 거리 조성으로 관광 인프라 및 지역경제 활성화기여,경상북도 구미시 인동28길 20 일원,경상북도 구미시 진평동 79-4,054-480-5492
전자의거리,"가전제품,전자부품,음향기기,전기자재,CCTV,컴퓨터,영상 및 방송시설 등 전자상가 중심의 상점거리",광주광역시 동구 독립로264번길 25,광주광역시 동구 대인동 27,062-608-2715
아시아음식문화거리,각국의 음식과 문화를 맛보고 체험할 수 있는 음식테마거리 조성,광주광역시 동구 문화전당로35번길 18-1,광주광역시 동구 광산동 92-19,062-608-2413
예술의거리,"갤러리와 화방,표구점,골동품점, 소극장, 전통찻집이 모여있는 거리",광주광역시 동구 예술길 24,광주광역시 동구 궁동 52-2,062-608-2403
모다 먹거리,"쇼핑, 교통, 숙박시설 등 입지조건이 우수하고 다양한 메뉴의 120여개소의 음식점이 밀집되어 있는 거리",대구광역시 달서구 달서대로85길 9,대구광역시 달서구 호림동 22,053-667-2782
수밭골 웰빙음식거리,"농림축산식품부 주관 우수외식업지구로 선정되었으며 친환경, 우수농산물을 사용한 슬로우 푸드를 주로 판매하는 웰빙음식거리",대구광역시 달서구 수밭길 50,대구광역시 달서구 도원동 1119,053-667-2782
허준테마거리,의성 허준과 동의보감의 우수성과 가치를 강조한 상징물들로 꾸며진 강서구 대표 테마거리,서울특별시 강서구 양천로55길,서울특별시 강서구 가양동 1477-2,02-2600-6804
의정부부대찌개 거리,의정부시의 대표 음식인 부대찌개를 즐길 수 있는 거리,경기도 의정부시 호국로1297번길,경기도 의정부시 의정부동 214-4,031-846-9977
향촌동 수제화골목,"과거 향촌동 일대는 예술인들이 즐겨찾는 문화의 거리였습니다. 1970년대부터 수제화공장 및 전문점이 하나둘씩 들어서 1980년대 본격적으로 수제화 골목으로 불리기 시작했습니다. 현재 향촌동 점포 및 공장, 재료상, 구두수리점이 모여 있으며, 디자인, 재단, 미싱, 신발바닥 등 수제화 기술분야의 장인들이 순수 100프로 가죽 수제화를 생산하고 있습니다. 생산된 제품은 전국으로 납품하고 있습니다.",대구광역시 중구 서성로14길 78,대구광역시 중구 대안동 19-3,053-661-2643
향토음식거리,단양 향토음식(쏘가리) 특화 거리,충청북도 단양군 단양읍 수변로 111,충청북도 단양군 단양읍 별곡리 569-1,043-420-3322
천안가구웨딩거리,웨딩과 가구점이 밀집되어 있는 거리,충청남도 천안시 서북구 백석로,충청남도 천안시 서북구 성정동 683-12,041-521-5609
공구상가거리,공구상가가 밀집되어 있는 거리,충청남도 천안시 서북구 신용로,충청남도 천안시 동남구 다가동 368-39,041-521-5609
병천순대거리,순대국밥집이 밀집되어 있는 거리,충청남도 천안시 동남구 병천면 아우내순대길,충청남도 천안시 동남구 병천면 병천리 289-14,041-521-5609
"국동 장어탕, 횟집거리","장어탕, 횟집 특화음식",전라남도 여수시 어항단지로 13+전라남도 여수시 어항단지로 63-3,전라남도 여수시 국동 1082-7+전라남도 여수시 국동 1082-51,061-659-4350
봉산동 게장백반거리,"간장게장, 양념게장 특화음식",전라남도 여수시 봉산남4길 12 + 전라남도여수시 봉산남3길 19,전라남도 여수시 봉산동 282-10+전라남도 여수시 봉산동 265-23,061-659-4350
좌수영음식문화거리,"장어탕, 서대회 특화음식",전라남도 여수시 중앙로 72-16 +전라남도 여수시 교동남1길 6-17,전라남도 여수시 중앙동 775+전라남도 여수시 교동 572-2,061-659-4350
덕양곱창전골거리,"곱창전골, 막창구이 특화음식",전라남도 여수시 소라면 하세동길 8-1 +전라남도 여수시 소라면 덕양로 448-2,전라남도 여수시 덕양리 1271+전라남도 여수시 덕양리 1275,061-659-4350
"학동, 선소 퓨전 음식거리","한식, 양식, 일식 퓨전 특화음식","전라남도 여수시 시청동3길 3, 1층 +전라남도 여수시 시청동3길 34",전라남도 여수시 학동 85-12+전라남도 여수시 학동 177-7,061-659-4350
해양공원 해물삼합거리,해물삼합 특화음식,"전라남도 여수시 이순신광장로 137, 제1동 2층 +전라남도 여수시 하멜로 102",전라남도 여수시 중앙동 266+전라남도 여수시 종화동 292-1,061-659-4350
나무전거리,"목재,문짝,씽크대,합판 등을 취급하고 창호를 비롯한 문 가공하는 거리",광주광역시 동구 경양로 300-1,광주광역시 동구 동명동 253-1,062-608-2715
미음나루음식문화특화거리,"미음나루는 조선시대 이전부터 한강을 오가는 배들의 중간 쉼터이자, 지금의 남양주시와 하남시의 미사리를 건너던 곳이었다. 그 덕에 사람의 왕래가 많아 이들을 대상으로 한 주막들이 꽤나 번성 했다. 안동김씨 후손의 호를 따서 이름이 붙혀진 나루터로 현재는 예전의 뱃사공 은 사라지고 한강변을 따라 드라이브를 즐기러 온 사람들이 뱃사공을 대신한다. 인근 야산에 축조된 수석리 토성은 삼국시대에는 한강변을 지키는 전략적 요충지의 일환으로 중요시 되었던 곳으로 여겨진다. 이곳 미음나루풍속마을 주변에는 매운탕과 장어구이 등 음식점이 30여개가 밀집되어 있고 분위기 있는 까페와 한정식 집들이 미식가들의 입맛을 돋우고 있으며 철에 따라 변화하는 강변의 풍광과 한강의 야경을 즐기려는 많은 사람들의 발걸음이 끊이질 않고 있다.",경기도 남양주시 강변북로 632번길 26(수석동),경기도 남양주시 수석동 168,031-590-2237
삼봉리 음식문화마을,"북한강변에 위치한 삼봉리 음식문화 마을은 수려한 자연환경과 영화촬영소, 유기농테마파크, 다산 정약용 유적지, 북한강 수상스키장, 자전거도로 등의 관광자원을 가지고 있는 지역으로 20여개의 음식점과 10여개의 까페들이 영업중에 있으며  특히 이 지역의 식당들은 직접재배하고 가꾼 농산물을 가지고 조리판매를 하고 있어 꾸준히 외식관광객들이 찾고 있음",경기도 남양주시 조안면 북한강로 856,경기도 남양주시 조안면 삼봉리 277-1,031-590-2237
라페스타 문화의 거리,"총 6개동, 2만여 평의 초대형 쇼핑몰로 패션 상가 및 음식점, 다양한 공연 등이 펼쳐지는 젊음의 거리",경기도 고양시 일산동구 중앙로 1275번길 60-30,경기도 고양시 일산동구 장항동 768,031-920-9600
덕이동 패션 아울렛,패션의류 및 잡화업종 유명 브랜드 할인점이 다수 입점한 쇼핑의 거리,경기도 고양시 일산서구 탄중로101번길 13,경기도 고양시 일산서구 덕이동 384-1,031-925-0606
화정문화의거리,덕양구 화정역을 중심으로 재미있는 길거리 공연과 쇼가 펼쳐지는 젊음의 거리,경기도 고양시 화정로 63,경기도 고양시 덕양구 화정동 963,031-936-9344
노량진 컵밥거리,"노점으로 인한 보행불편, 위생, 안전 등 다양한 문제해결을 위해 좁은 보도에 밀집한 노점들을 보도공간이 넓은 곳으로 이전하여 ‘거리가게 특화거리’ 조성",서울특별시 동작구 노량진로 178,서울특별시 동작구 노량진동 148-88,02-820-9152
장안문거북시장길,30년 이상된 점포들이 대부분이며 설렁탕 곱창 보쌈 등 한식 위주의 음식점이 많음,경기도 수원시 장안구 정조로934번길 일원(영화동),경기도 수원시 장안구 영화동 302,031-228-2228
파장천맛고을,콩요리 사골청국장 추어탕 오리고기 등 100㎡ 이상의 규모가 크고 오래된 전통음식점이 많음,경기도 수원시 장안구 파장천로 92 일원(파장동),경기도 수원시 장안구 파장동 328-1,031-228-2228
반딧불이 연무시장 낭만거리,오징어 요리 매운탕 스테이크 등 다양한 먹거리가 있음,경기도 수원시 장안구 월드컵로428번길 20 일원(연무동),경기도 수원시 장안구 연무동 236-1,031-228-2228
금곡동 어울림상가 음식문화거리,젊은층이 좋아하는 프랜차이즈 음식점 커피전문점 등이 많이 있음,경기도 수원시 권선구 금호로 73-17 일원(금곡동),경기도 수원시 권선구 금곡동 1136-1,031-228-2228
화성행궁맛촌거리,수원화성박물관 수원통닭거리 지동순대타운 등이 도보로 10분 이내 거리에 있어 관광객들이 꾸준히 찾아오고 있음.,경기도 수원시 팔달구 행궁로 28 일원(남창동),경기도 수원시 팔달구 남창동 91-3,031-228-2228
천천먹거리촌,한식 중식 일식 등을 취급하는 20년 이상된 먹거리촌으로 음식점과 한지 악기 건강식품점 등이 있으며 최근 젊은층이 선호하는 마카롱 와플 등의 까페들도 생기면서 남녀노소 즐길 수 있는 먹거리촌을 형성하고 있음.,경기도 수원시 장안구 덕영대로511번길 29-18 일원(천천동),경기도 수원시 장안구 천천동 507-14,031-228-2228
수원통닭거리,2019년 영화 극한직업에 수원의 대표 메뉴인 왕갈비와 통닭을 결합한 수원 왕갈비통닭이 나온 이후 통닭거리가 더 유명해져 많은 관광객이 찾고 있음.,경기도 수원시 팔달구 수원천로 311일원(남수동),경기도 수원시 팔달구 남수동 130-5,031-228-2228
호매실벚꽃음식문화거리,전국방방곡곡 특색있는 음식(경상도식 뭉티기 대구식 납작만두 충청도식 냉동삼겹살 제주도 특수돼지고기 전라도식 부침개 전국팔도 모듬 음식)을 넘어 세계적인 음식(중국 정통 양꼬치 경상원 청년창업사관학교 선정 퓨전음식 정통 이태리 파스타)까지 즐길수 있는 개성있고 경쟁력 있는 많은 음식점이 있음.,경기도 수원시 권선구 금곡로118번길 60(금곡동)일원,경기도 수원시 권선구 금곡동 1090-7,031-228-2228
행리단길 음식문화거리,화성행궁 근처에 행리단길이 조성되어 카페· 식당· 소품가게 등 데이트 코스로 각광받고 있음,경기도 수원시 팔달구 신풍로 47(신풍동) 일원,경기도 수원시 팔달구 신풍동 32-1,031-228-2228
장다리로 음식문화거리,갈비· 경양식· 칼국수집 등 대형 맛집을 중심으로 외식대표메뉴들이 밀집되어있음,경기도 수원시 팔달구 장다리로 231(인계동) 일원,경기도 수원시 팔달구 인계동 971-5,031-228-2228
남산인쇄골목,남산동 남문시장에서 계산오거리까지의 500여미터 남짓한 거리에는 각종 인쇄소와 기획사가 빽빽히 밀집해 있습니다. 인쇄골목은 1980년대초부터 서서히 형성되기 시작하여 1990년대 들어 급속한 팽창을 보였으며 현재 500여개의 업체가 영업중에 있습니다.,대구광역시 중구 명륜로6길 7-24,대구광역시 중구 남산동 247-12,053-661-2643
충무동 골목시장 고갈비특화거리,"충무동 골목시장에 추억의 향토음식인 고갈비를 특화한 거리로 골목시장 사거리에 있는 일명 파전골목을 기존 건물의 간판 등을 모두 철거·정비하고, 시장아치, 유도사인물 보수와 리모델링하여 고갈비전문 음식점 (12개 업소와 7개 이동식판매대)으로 변모하여 손님 맞이에 나서고 있다",부산광역시 서구 충무시장길 30(충무동1가),부산광역시 서구 충무동1가 29-1,051-240-4475
문화의거리,"울산동헌과 문화의거리가 상가 주변에 위치하고 있어 원도심 도보 여행 코스로 적정한 장소이며, 거리내 다수의 미술작품이 설치되어 있고 거점건물에는 파사드를 설치하여 볼거리가 풍부한 지역이다.  ○ 중앙길상가 내 문화의거리 주변에는 문화예술업종이 50개소(갤러리, 공방, 조각 등)가 입점되어 있으며, 2019년 올해의 관광도시로 지정된 지역이다.",울산광역시 중구 중앙길 119,울산광역시 중구 성남동 87-5,052-290-3660
용종마을 음식문화시범거리,"용종마을은 소문난 맛집이 많고, 웰빙 위주의 깔끔한 식단으로 가족 단위의 외식장소로 많은 사랑을 받고 있습니다.",인천광역시 계양구 용마루길,인천광역시 계양구 용종동 219-6,032-450-5424
보정동 카페거리,용인시 지정 1호 문화의 거리로 카페·레스토랑·의류 등 120여개의 점포가 밀집하였으며 각종 드라마·CF·화보 촬영장소로 더욱 유명해짐,경기도 용인시 기흥구 죽전로15번길 일원,경기도 용인시 기흥구 보정동 1185,031-324-2102
낙지특화거리,"버스터미널 주변상가 및 노점상에서 무안갯벌에서잡은 낙지를 요리 및 판매한는 사람들이 생겨나면서 낙지골목이란 명칭으로 불리우기 시작 현재 약 50여개상가중 39개 점포가 낙지 도소매 상가 및 낙지요리 식당입니다. 낙지요리에는 연포탕, 회무침, 비빔밥, 호롱 등이있습니다.",전라남도 무안군 무안로 497-1,전라남도 무안군 무안읍 성동리 1046,061-450-0518
송도꽃게거리,"꽃게의 제철에 송도유원지 앞에서 인천상륙작전기념관 앞까지 이르는 길에는 꽃게요리를 맛보려는 차량행렬과 사람물결이 이어진다. 이곳이 바로 꽃게탕을 주메 뉴로 하는 음식점이 밀집되어 있는 꽃게거리다. 인천 사람도 많지만 서울이나 인근 수도권에서 일부러 꽃게요리를 맛보기 위해 찾는 발길도 많다. 제철이 따로 있다지만 저장기술이 발달한 요즈음은 사시사철 속이 꽉 찬 꽃게를 맛볼 수 있다. 유원지와 기념관, 시립박물관 등이 지척이라 가족나들이 코스로도 손색없다.","인천광역시 연수구 능허대로217,인권로8,대암로22번길 일원","인천광역시 연수구 옥련동 555-2, 옥련동 550",032-749-7952
