거리명,거리소개,소재지도로명,소재지지번주소,관리기관전화번호
연수동 맛고을길,"음식문화시범거리는 연수동 소재의 음식점 밀집지역인 맛 고을길 을 중심으로 하여 상차림 간소화 운동을 비롯한 좋은 식단 운동을 실천하는 업소들을 선정하여 지정한 거리이다. 이 거리에서는 특색 있고 맛깔스러우면서도 안전한 먹거리를 제공하여 찾는 이들이 보다 수준 높은 음식문화를 누릴 수 있도록 할 것이다. 더불어 이곳에 오면 구이류, 찌게류, 회 등 다양한 음식으로 골고루 맛 볼 수 있다.","인천광역시 연수구 샘말로 21.30.38.43.44번길,청능대로 113번길 일원",인천광역시 연수구 연수동 628-12,032-749-7952
선학동음식문화시범거리,선학동 먹자거리,인천광역시 연수구 학나래로 6.14.22.46.118번길 일원,인천광역시 연수구 선학동 408-5,032-749-7952
오송도송음식문화특화거리,구(舊) 송도 지역의 음식과 문화가 어우러진 오송도송 음식문화 특화거리,인천광역시 연수구 능허대로 267,인천광역시 연수구 동춘동 812번지,032-749-7952
부평문화의거리,차없는 거리로 지정된 각종 공연과 다양한 문화활동이 펼쳐지고 있는 인천 최대 규모의 의류 중심 거리,인천광역시 부평구 부평문화로,인천광역시 부평구 부평동 201-141,032-509-6540
월곡동세계음식문화거리,다양한 국적의 음식점들이 한데 모인 세계문화음식테마거리,광주광역시 광산구 산정공원로,광주광역시 광산구 산정동 945-1,062-960-6857
문화의거리,공연+특산품 및 지역생산품 판매+각종 행사 등 문경의 문화를 느끼고 즐길 수 있는 거리,경상북도 문경시 중앙8길,경상북도 문경시 점촌동 268-46,054-550-6346
짬뽕특화거리,전통과 특색있는 군산의 짬뽕 관광자원을 활용 특화거리 조성,전북특별자치도 군산시 동령길 57,전북특별자치도 군산시 장미동 21-5,063-454-3413
걷고싶은거리,구도심 지역에 위치한 상가 밀집 거리,전북특별자치도 전주시 완산구 전주객사 4길+5길,전북특별자치도 전주시 완산구 고사동 203-6,063-281-5325
공구의거리,공구 관련 상가들이 밀집한 거리,전북특별자치도 전주시 완산구 대동로,전북특별자치도 전주시 완산구 고사동 227-19,063-281-5325
동문문화거리,한옥마을과 인접해 각종 문화시설 밀집,전북특별자치도 전주시 완산구 동문길,전북특별자치도 전주시 완산구 경원동2가 24-6,063-281-5325
영화의거리,구도심 영화관이 밀집한 거리,전북특별자치도 전주시 완산구 전주객사 3길+4길,전북특별자치도 전주시 완산구 고사동 362-3,063-281-5325
웨딩거리,웨딩관련 업종의 상가가 밀집,전북특별자치도 전주시 완산구 전라감영 2길+3길+4길+5길,전북특별자치도 전주시 완산구 중앙동3가 102-5,063-281-5325
차이나거리,중국 소주시와 자매결연을 기념으로 조성된 거리,전북특별자치도 전주시 완산구 전라감영 2길,전북특별자치도 전주시 완산구 다가동1가 44-1,063-281-5325
쌍화차거리,"난방시설이 잘되어 있지 않던 시절, 추운 겨울날 정읍경찰서 구치소에 수감된 사람들에게 몸을 녹이라고 가족들이 쌍화차를 사식으로 넣어주기 시작하면서부터 유래되었다고 전해짐",전북특별자치도 정읍시 중앙1길,전북특별자치도 정읍시 수성동 637-3,063-539-5602
익산문화예술의거리,익산시 구도심 일원 KTX역세권과 연계한 주거문화상업 아트지구,전라북도 익산시 중앙로(중앙동2가),전라북도 익산시 중앙동2가 45,063-859-5826
마지리벽화마을,말과 소로 대표되는 마을의 특성을 벽화로 표현,"경기도 파주시 적성면 솥뒤로 37번길, 57번길 일대","경기도 파주시 적성면 마지리 39번지, 172번지 일대",031-940-8189
EBS연풍길,연풍시장길에 EBS 콘텐츠를 도입하여 특화거리 조성,경기도 파주시 연풍5길 일원,경기도 파주시 파주읍 연풍리 299-5번지 일원,031-940-5722
장단콩 두부특화거리,파주시 지역특산물 장단콩을 활용하여 특색있는 두부 먹거리 촌으로 조성,경기도 파주시 법원읍 사임당로 809-1 ~ 827 일원,경기도 파주시 법원읍 대능리 94-192 ~ 94-38 일원,031-940-8466
전포카페거리,"번화가인 서면1번가 맞은편 쪽에는 아기자기하게 꾸며놓은 개성있는 카페 30여곳이 들어서 있는 카페거리는 원래 공구, 철물 등 산업용품 및 자재를 파는 가게들이 많던 공구상가 거리였으나 2010년 이후 아기자기한 카페들이 들어서면서 이색적인 카페거리로 불리고 있다.",부산광역시 부산진구 전포대로209번길 26,부산광역시 부산진구 전포동 682,051-605-5822
명품가로공원,"도심 속 일상생활에서 접할 수 있는 다양한 수목과 초화, 수경시설을 만날 수 있는 쉼터",부산광역시 사상구 광장로,부산광역시 사상구 괘법동 572-18,051-310-4536
삼락재첩거리,사상구의 유명 요리인 재첩국을 맛볼 수 있는 맛집이 모여 있는 거리,부산광역시 사상구 낙동대로1530번길,부산광역시 사상구 삼락동 69-9,051-310-4067
운연동 추어마을,"원래는 농촌마을이었으나 논에 미꾸라지가 많이 잡히면서 마을 주민들이 추어탕을 즐겨 만들어 먹었음. 서울식,남도식,원주식 등 손님의 입맛에 맞게 고를수 있는 추어탕 음식점이 밀집되어있어 2006년 특색음식거리로 지정",인천광역시 남동구 수인로 3536,인천광역시 남동구 운연동 40-15,032-453-8472
구월문예길음식문화1번가,"이 지역은 일명 구월동 밴댕이 골목으로 대형쇼핑몰, 문화예술회관 등이 밀집되어있어 문화와, 예술, 쇼핑을함께 즐길수 있는 곳으로 2002년 월드컵을 대비하여 2001년 특색음식거리로 지정",인천광역시 남동구 문화서로 4번길 61-16,인천광역시 남동구 구월동 1406-4,032-453-8472
소래포구신도로횟집거리,소래포구는 인천의 명소로 먹거리 발굴 및 육성을 위해 횟집 밀집지역인 신도로 지역을 2011년도에 특색음식거리로 지정,인천광역시 남동구 포구로 15,인천광역시 남동구 논현동 111-247,032-453-8472
구월로데오음식문화거리,"백화점, 터미널, 쇼핑센터, 음식점 등이 밀집한 지역으로 인천의 핫플레이스로 2019년 음식문화거리로 지정",인천광역시 남동구 성말로 10,인천광역시 남동구 구월동 1463번지,032-453-8472
맛고을 문화의 거리,100여개 점포중 50개소 이상 음식 상가 밀집지역의 음식 문화 거리,경상북도 예천군 예천읍 맛고을길 19,경상북도 예천군 예천읍 남본리 222-66,054-650-6231
걷고싶은거리,구도심 지역에 위치한 상가 밀집 거리,전라북도 전주시 완산구 전주객사 4길+5길,전라북도 전주시 완산구 고사동 203-6,063-281-5325
공구의거리,공구 관련 상가들이 밀집한 거리,전라북도 전주시 완산구 대동로,전라북도 전주시 완산구 고사동 227-19,063-281-5325
동문문화거리,한옥마을과 인접해 각종 문화시설 밀집,전라북도 전주시 완산구 동문길,전라북도 전주시 완산구 경원동2가 24-6,063-281-5325
영화의거리,구도심 영화관이 밀집한 거리,전라북도 전주시 완산구 전주객사 3길+4길,전라북도 전주시 완산구 고사동 362-3,063-281-5325
강릉월화거리,무월랑과 연화낭자의 이야기가 있는 명소거리,강원도 강릉시 경강로 2112,강원도 강릉시 임당동 113-2,033-640-5643
이순신대교 먹거리타운,이순신 대교 일대의 먹거리 타운,전라남도 광양시 발섬6길,전라남도 광양시 중동 1798,061-797-4052
진월망덕포구 먹거리타운,광양전어 축제가 열리는 망덕 포구 일대의 먹거리 타운,전라남도 광양시 진월면 망덕길,전라남도 광양시 진월면 망덕리 845-82,061-797-4052
서초음악문화지구,클래식 문화예술 특화거리,남부순환로317길,서울특별시 서초구 서초동 1475,02-2155-6202
이태원길,지역 상업지구 주변을 문화와 감성의 예술거리 브랜드화하여 새로운 젊음의 거리를 통한 지역경제 활성화,대구광역시 북구 동천로 129-16(일원),대구광역시 북구 동천동 903-2(일원),053-665-4322
꿈안전어울림꽃피는 여성친화 골목길,태안군 태안읍 동문2·4리에 위치한 대지길은 태안중학교 후문에서 시작해 터널길까지 약0.3km정도로 등하교를 하는 학생 뿐만 아니라 시내에 인접하여 마을 주민들도 많이 이용하는 거리로서  꽃과 함께 청소년 쉼터 테마거리로 조성하여 ① 청년층에게 새로운 문화의 장으로 ② 중장년층에는 옛시절 향수를 불러일으킬 수 있는 거리로 ▲ 모든 세대가 서로 공감하며 소통할 수 있는 문화공간,충청남도 태안군 태안읍 대지길 34,충청남도 태안군 태안읍 동문리 839-3,041-670-2277
독산성 음식문화거리,경기옛길삼남길7코스인 독산성자락 주변 둘레길을 따라 40여곳의 다양한 맛집거리,경기도 오산시 독산성길,경기도 오산시 지곶동 277-1,031-8036-6824
깔깔거리,구로디지털단지가 인접한 음식문화 특화거리,"서울특별시 구로구 디지털로32길, 디지털로32나길 일대",서울특별시 구로구 구로동 1124-7 (인근),02-860-3233
영덕대게거리,200여개의 대게상가들이 밀집해있는 음식테마거리,경상북도 영덕군 강구면 강구대게길 31-2,경상북도 영덕군 강구면 강구리 475,054-730-6393
남가람 문화거리,"역사, 문화, 예술도시인 진주의 전통과 독특한 문화적 개성을 지닌 도심속의 문화, 휴식공간",경상남도 진주시 강남로,"경상남도 진주시 칠암동 201-1,201-5",055-749-8592
염치한우촌,20여년전 아산 도축장이 있을 때 부터 자연적으로 형성된 한우 특화거리,충청남도 아산시 염치읍 염성길 105,충청남도 아산시 염치읍 염성리 264-1,041-540-2248
온주맛고을,새로이 조성된 먹거리촌으로 다양한 먹거리와 함께 각종 문화재 등 주변 볼거리를 즐길 수 있다.,충청남도 아산시 외암로 1400,충청남도 아산시 읍내동 288-3,041-540-2248
강릉월화거리,무월랑과 연화낭자의 이야기가 있는 명소거리,강원도 강릉시 경강로 2112,강원도 강릉시 임당동 113-2,033-640-5643
구룡포 일본인 가옥거리,일제강점기 때 일본인 집단 거주지,경상북도 포항시 남구 구룡포읍 구룡포길 153-1,경상북도 포항시 남구 구룡포읍 구룡포리 153-1,054-270-2274
순천시 문화의 거리,"천년의 역사를 간직하고 있는 순천시의 영동 행동 금곡동 일원은 1309년 순천 지명이 처음 등장한 이후 현재까지 전남 동부권의 역사. 문화. 교육. 행정의 중심지였다.문화의 거리에는 옛 문화의 정취를 느낄 수 있는 700년 순천부읍성, 순천향교, 임청대 등 다양한 전통문화유산과 100년 전 미국선교사들이 순천에 자리 잡아 만들어진 근대기 마을 등 순천 사람들이 살아왔던 이야기와 풍경들이 있다.1000년을 넘게 이어져온 순천의 이야기는 도심의 현대화, 도시 중심기능 및 상권의 이동에 따라 쇠퇴하게 된다. 순천시는 원도시의 정체성을 되찾고 신시가지와 상생할 수 있는 방안으로 원도심이 가진 풍부한 역사문화자원을 활용하여 ’천년의 역사 문화가 숨 쉬는 거리’ 조성사업을 추진하였다.",전라남도 순천시 금곡길 28 일원,전라남도 순천시 행동 95,061-749-6802
